{
  "name": "tracedecay",
  "version": "0.0.0",
  "description": "Claude Code integration for TraceDecay semantic code intelligence: MCP server plus a `tracedecay tool` CLI fallback exposing the same tools when MCP is unavailable.",
  "author": {
    "name": "ScriptedAlchemy"
  },
  "homepage": "https://github.com/ScriptedAlchemy/tracedecay",
  "repository": "https://github.com/ScriptedAlchemy/tracedecay",
  "license": "MIT",
  "keywords": [
    "code-graph",
    "mcp",
    "code-search",
    "token-savings",
    "call-graph",
    "code-health"
  ]
}
